"Zona","Precio (€/mes)","Habitaciones","Baños","Metros cuadrados","Planta","Ubicación","Caracteristicas","Extras","Contacto","Telefono","Detalles contacto","Descripcion","Images","ref. Fotocasa","url"
"Esparreguera","1250","4","2","200","","Casa adosada en Esparreguera, Zona De - Esparreguera / Esparreguera","Tipo de inmueble : Casa adosada, Estado : Casi nuevo, Orientación : Orientación Suroeste","Aire acondicionado, Armarios, Balcón, Calefacción, Cocina Equipada, Cocina Office, Gres Cerámica, Horno, Internet, Jardín Privado, No amueblado, Puerta Blindada, Terraza, Trastero","Finques Isavi","932753128","Referencia : 5785 Contacto: Finques Isavi","Se alquila magnifica casa adosada a 3 vientos esquinera en zona inmejorable de Esparreguera pleno centro, consta de 200m2, 4 habitaciones ( 1 estudio de despacho de unos 30m2, 2 habitaciones dobles ( 1 suite con balcón con baño completo con bañera) y 1 individual), 2 baños completos ( 1 con plato de ducha y 1 con bañera) y 2 aseos, salon comedor amplio y luminoso con salida a terraza, despacho, cocina independiente completa sin electrodomesticos con salida a jardin, parcela de 55m2, suelo de gress porcelanato, ventanas de aluminio climalit + rejas, puertas interiores de madera de haya, no amueblado, jardin privado, fibra optica, porche en entrada para tapar coche, alarma, caseta de madera como trastero, descalsificador osmosis, aire acondicionado y calefaccion de gas natural. La distribucion es 1 PLANTA: comedor 1 aseo cocina independiente  jardin trasero y terraza a calle 2 PLANTA: 3 habitaciones  2 baños completos PLANTA BAJA: porche coche, despacho. Toda exterior y muy luminosa. PARA ENTRAR A VIVIR A PARTIR DEL 15022019. No duden en llamar para más informacion.","https://d.inmofactory.com/1/92826/14503474/176000005.jpg/690x518/p_1, https://d.inmofactory.com/1/92826/14503474/176000025.jpg/690x518/p_1, https://d.inmofactory.com/1/92826/14503474/176000019.jpg/690x518/p_1, https://d.inmofactory.com/1/92826/14503474/176000002.jpg/690x518/p_1, https://d.inmofactory.com/1/92826/14503474/176000022.jpg/690x518/p_1, https://d.inmofactory.com/1/92826/14503474/176000015.jpg/690x518/p_1, https://d.inmofactory.com/1/92826/14503474/175999995.jpg/690x518/p_1, https://d.inmofactory.com/1/92826/14503474/175999998.jpg/690x518/p_1, https://d.inmofactory.com/1/92826/14503474/175999993.jpg/690x518/p_1, https://d.inmofactory.com/1/92826/14503474/176000000.jpg/690x518/p_1, https://d.inmofactory.com/1/92826/14503474/176000007.jpg/690x518/p_1, https://d.inmofactory.com/1/92826/14503474/176000014.jpg/690x518/p_1, https://d.inmofactory.com/1/92826/14503474/176000017.jpg/690x518/p_1, https://d.inmofactory.com/1/92826/14503474/176000021.jpg/690x518/p_1","149519077","https://www.fotocasa.es/vivienda/esparreguera/aire-acondicionado-calefaccion-jardin-terraza-trastero-internet-no-amueblado-esparreguera-149519077?RowGrid=13&tti=3&opi=300"
"Olesa de Montserrat","700","3","2","96","","Dúplex en Olesa De Montserrat- Zona Estación / Olesa de Montserrat","Tipo de inmueble : Dúplex, Estado : Muy buen estado, Antigüedad : De 10 a 20 años","Aire acondicionado, Ascensor, Balcón, Calefacción, Cocina Office, Gres Cerámica, Horno, Lavadero, No amueblado, Puerta Blindada, Suite - con baño, Terraza, Videoportero","Paniello Finques","935435235","Referencia : 09-2019 Contacto: Paniello Finques","Duplex Semi Nuevo con Terraza muy amplia, cocina independiente exterior a un balcón,  3 habitaciones ( 1 suitte), video portero, aire acondicionado, puerta blindada, suelo de gres, ventanas de aluminio, escaleras en el recibidor, recien pintado, etc","https://d.inmofactory.com/1/104471/16189429/214128255.jpg/690x518/p_1","149557210","https://www.fotocasa.es/vivienda/olesa-de-montserrat/aire-acondicionado-calefaccion-terraza-ascensor-no-amueblado-olesa-de-montserrat-149557210?RowGrid=14&tti=3&opi=300"
"Esparreguera","1200","4","2","240","","Chalet en Esparreguera / Esparreguera","Tipo de inmueble : Chalet","Calefacción, Cocina Office, Garaje Privado, Trastero","Finques Isavi","932753128","Referencia : 5486 Contacto: Finques Isavi","Se alquila con opcion a compra o se vende magnfica y espectacular  casa a 4 vientos en zona inmejorable de Esparreguera (  MAS D EN GALL) consta de 240 m2, 4 habitaciones (3 dobles y 1 individual), 2 baños  completos ( 1 con bañera y 1 con plato de ducha), salon comedor amplio y luminoso con chimenea, cocina equipada office con pequeño lavadero, suelo de gres, ventanas de madera, puertas interiores de madera, calefaccion electrica, parcela jardin de 300m2, barbacoa, vistas a Montserrat, NO AMUEBLADA, trastero y garaje para 3 coches. Lista para entrar a vivir. GRAN OPORTUNIDAD NO DUDEN EN LLAMAR PARA MÁS INFORMACION. CONDICIONES ALQUILER OPCION COMPRA: Entrada de 20.000 €  Alquiler mensual: 1200 € A Escriturar en un plazo maximo de 3 años.","https://d.inmofactory.com/1/92826/14849734/205515736.jpg/690x518/p_1, https://d.inmofactory.com/1/92826/14849734/190830803.jpg/690x518/p_1, https://d.inmofactory.com/1/92826/14849734/205515737.jpg/690x518/p_1, https://d.inmofactory.com/1/92826/14849734/205515738.jpg/690x518/p_1, https://d.inmofactory.com/1/92826/14849734/190830802.jpg/690x518/p_1, https://d.inmofactory.com/1/92826/14849734/190830804.jpg/690x518/p_1, https://d.inmofactory.com/1/92826/14849734/184163049.jpg/690x518/p_1, https://d.inmofactory.com/1/92826/14849734/190830805.jpg/690x518/p_1, https://d.inmofactory.com/1/92826/14849734/190830806.jpg/690x518/p_1, https://d.inmofactory.com/1/92826/14849734/190830807.jpg/690x518/p_1, https://d.inmofactory.com/1/92826/14849734/190830808.jpg/690x518/p_1, https://d.inmofactory.com/1/92826/14849734/205515739.jpg/690x518/p_1, https://d.inmofactory.com/1/92826/14849734/205515740.jpg/690x518/p_1, https://d.inmofactory.com/1/92826/14849734/205515741.jpg/690x518/p_1, https://d.inmofactory.com/1/92826/14849734/205515742.jpg/690x518/p_1, https://d.inmofactory.com/1/92826/14849734/205515743.jpg/690x518/p_1, https://d.inmofactory.com/1/92826/14849734/205515744.jpg/690x518/p_1, https://d.inmofactory.com/1/92826/14849734/205515745.jpg/690x518/p_1","148182981","https://www.fotocasa.es/vivienda/esparreguera/calefaccion-parking-trastero-esparreguera-148182981?RowGrid=15&tti=3&opi=300"
"Esparreguera","1200","6","3","240","","Chalet en Esparreguera / Esparreguera","Tipo de inmueble : Chalet","Aire acondicionado, Balcón, Cocina Office, Garaje Privado, Gres Cerámica, Jardín Privado, Terraza, Trastero, Vistas a la montaña","Alma House Servicios Inmobiliarios","932886918","Referencia : AL-167 Contacto: Alma House Servicios I...","Estás buscando una casa de ALQUILER sólo CON OPCIÓN A COMPRA?? Te ofrecemos este fantástico chalet de 14 años de antigüedad que tiene 240 m2 con unos 400 m2 de terreno y está ubicada en un zona tranquila. La vivienda consta de 6 habitaciones, 3 baños, cocina tipo office y salón comedor con chimenea.... ideal para comidas, encuentros y tertulias familiares o con amigos. Aire acondicionado. Los suelos interiores son de gres y la carpintería exterior de aluminio. Dispone de terraza, balcón y de un gran jardín y una zona con barbacoa preparada para comer en el exterior. La vivienda cuenta también con un trastero y un parking de unos 90 m2 aprox. No pierdas ni un minuto más y llámanos.... te informaremos con todo detalle !!","https://d.inmofactory.com/1/111281/15771274/205318079.jpg/690x518/p_1, https://d.inmofactory.com/1/111281/15771274/205317938.jpg/690x518/p_1, https://d.inmofactory.com/1/111281/15771274/205317979.jpg/690x518/p_1, https://d.inmofactory.com/1/111281/15771274/205317945.jpg/690x518/p_1, https://d.inmofactory.com/1/111281/15771274/205317958.jpg/690x518/p_1, https://d.inmofactory.com/1/111281/15771274/205317999.jpg/690x518/p_1, https://d.inmofactory.com/1/111281/15771274/205318006.jpg/690x518/p_1, https://d.inmofactory.com/1/111281/15771274/205318015.jpg/690x518/p_1, https://d.inmofactory.com/1/111281/15771274/205318023.jpg/690x518/p_1, https://d.inmofactory.com/1/111281/15771274/205318033.jpg/690x518/p_1, https://d.inmofactory.com/1/111281/15771274/205317951.jpg/690x518/p_1, https://d.inmofactory.com/1/111281/15771274/205318089.jpg/690x518/p_1","148950578","https://www.fotocasa.es/vivienda/esparreguera/aire-acondicionado-parking-jardin-terraza-trastero-esparreguera-148950578?RowGrid=16&tti=3&opi=300"
"Esparreguera","990","3","2","163","","Casa adosada en  Paraires / Esparreguera","Tipo de inmueble : Casa adosada, Estado : Casi nuevo, Antigüedad : De 10 a 20 años","Armarios, Cocina Equipada, Garaje Privado, Lavadero, No amueblado, Parking comunitario, Puerta Blindada, Terraza, Trastero","Inveriba","932934650","Referencia : 1515 Contacto: Inveriba","Ponemos en alquiler una casa en Esparraguera, Barcelona. Dispone de una superficie de 148m² distribuidos en 3 plantas. La planta baja consta de garaje y 1 porche. La primera planta consta de salón-comedor, cocina, 1 baño, 1 terraza y 1 patio. La segunda planta consta de 3 habitaciones, 1 baño y terraza. Situada cerca de centros educativos. Con fácil acceso a la autopista A-2.REQUISITOS PARA PODER REALIZAR UNA VISITA- Al menos uno de los inquilinos debe tener contrato indefinido.- La suma de los ingresos de los inquilinos debe ser al menos de 2.950€ para este inmueble en concreto","https://d.inmofactory.com/1/93528/15751738/204820428.jpg/690x518/p_1, https://d.inmofactory.com/1/93528/15751738/204820429.jpg/690x518/p_1, https://d.inmofactory.com/1/93528/15751738/204820430.jpg/690x518/p_1, https://d.inmofactory.com/1/93528/15751738/204820431.jpg/690x518/p_1, https://d.inmofactory.com/1/93528/15751738/204820432.jpg/690x518/p_1, https://d.inmofactory.com/1/93528/15751738/204820433.jpg/690x518/p_1, https://d.inmofactory.com/1/93528/15751738/204820434.jpg/690x518/p_1, https://d.inmofactory.com/1/93528/15751738/204820435.jpg/690x518/p_1, https://d.inmofactory.com/1/93528/15751738/204820436.jpg/690x518/p_1, https://d.inmofactory.com/1/93528/15751738/204820437.jpg/690x518/p_1, https://d.inmofactory.com/1/93528/15751738/204820438.jpg/690x518/p_1, https://d.inmofactory.com/1/93528/15751738/204820439.jpg/690x518/p_1, https://d.inmofactory.com/1/93528/15751738/204820440.jpg/690x518/p_1, https://d.inmofactory.com/1/93528/15751738/204820441.jpg/690x518/p_1, https://d.inmofactory.com/1/93528/15751738/204820442.jpg/690x518/p_1, https://d.inmofactory.com/1/93528/15751738/204820443.jpg/690x518/p_1, https://d.inmofactory.com/1/93528/15751738/204820444.jpg/690x518/p_1","148918120","https://www.fotocasa.es/vivienda/esparreguera/parking-terraza-trastero-parking-se-aceptan-mascotas-no-amueblado-esparreguera-148918120?RowGrid=17&tti=3&opi=300"
"Esparreguera","1000","4","1","150","","Casa adosada en Abrera / Esparreguera","Tipo de inmueble : Casa adosada","Aire acondicionado, Calefacción, Cocina Office, Garaje Privado, Lavadero, Terraza, Trastero, Vistas a la montaña","Rovira Asesoria Inmobiliaria","935431334","Referencia : 2591 Contacto: Rovira Asesoria Inmobi...","CASA ADOSADA CON TERRAZA DE 30M2, PORCHE DELANTERO PARA UN COCHE, SALON COMEDOR DE 25M2, COCINA EQUIPADA, TRASTERO, 4 HABITACIONES, 1 BAÑO COMPLETO Y ASEO, BUHARDILLA DE 20 CON SALIDA A UNA TERRAZA DE 15 M2, ARMARIOS EMPOTRADOS, SEMI AMUEBLADO.  NO SE ADMITEN PERROS","https://d.inmofactory.com/1/108188/16176878/213791972.jpg/690x518/p_1, https://d.inmofactory.com/1/108188/16176878/213791973.jpg/690x518/p_1, https://d.inmofactory.com/1/108188/16176878/213791974.jpg/690x518/p_1, https://d.inmofactory.com/1/108188/16176878/213791975.jpg/690x518/p_1, https://d.inmofactory.com/1/108188/16176878/213791976.jpg/690x518/p_1, https://d.inmofactory.com/1/108188/16176878/213791977.jpg/690x518/p_1, https://d.inmofactory.com/1/108188/16176878/213791978.jpg/690x518/p_1, https://d.inmofactory.com/1/108188/16176878/213791979.jpg/690x518/p_1, https://d.inmofactory.com/1/108188/16176878/213791980.jpg/690x518/p_1, https://d.inmofactory.com/1/108188/16176878/213791981.jpg/690x518/p_1, https://d.inmofactory.com/1/108188/16176878/213791982.jpg/690x518/p_1, https://d.inmofactory.com/1/108188/16176878/213791983.jpg/690x518/p_1, https://d.inmofactory.com/1/108188/16176878/213791984.jpg/690x518/p_1, https://d.inmofactory.com/1/108188/16176878/213791985.jpg/690x518/p_1, https://d.inmofactory.com/1/108188/16176878/213791986.jpg/690x518/p_1, https://d.inmofactory.com/1/108188/16176878/213791987.jpg/690x518/p_1","149537054","https://www.fotocasa.es/vivienda/esparreguera/aire-acondicionado-calefaccion-parking-terraza-trastero-esparreguera-149537054?RowGrid=18&tti=3&opi=300"
"Martorell","750","3","1","83","2ª","Piso en Calle Pep Ventura / Martorell","Tipo de inmueble : Piso, Planta : 2ª planta, Estado : Buen estado","Calefacción, Cocina Equipada, Parquet","Hiperfincas","932886415","Referencia : HF01600 Contacto: Hiperfincas","Piso en Martorell zona El pla, 83 m. 2º real sin ascensor,de superficie,  una habitación doble y 2 habitaciones sencillas,  un baño con plato de ducha, propiedad en buen estado, carpinteria interior de haya, orientación noroeste, suelo de parquet, carpintería exterior de aluminio.  Extras: agua, calefacción, gas ciudad , luminoso, puerta blindada.  cerca a esta propiedad tienes, autobuses, árboles, céntrico, centros comerciales, centros médicos, colegios, hospitales, montaña, parques, tren  No se aceptan mascotas.  llamanos!!!!!!!!!!!!!!!!","https://d.inmofactory.com/1/110026/16176753/213789221.jpg/690x518/p_1, https://d.inmofactory.com/1/110026/16176753/213789225.jpg/690x518/p_1, https://d.inmofactory.com/1/110026/16176753/213789231.jpg/690x518/p_1, https://d.inmofactory.com/1/110026/16176753/213789235.jpg/690x518/p_1, https://d.inmofactory.com/1/110026/16176753/213789237.jpg/690x518/p_1, https://d.inmofactory.com/1/110026/16176753/213789241.jpg/690x518/p_1, https://d.inmofactory.com/1/110026/16176753/213789243.jpg/690x518/p_1, https://d.inmofactory.com/1/110026/16176753/213789248.jpg/690x518/p_1, https://d.inmofactory.com/1/110026/16176753/213789249.jpg/690x518/p_1, https://d.inmofactory.com/1/110026/16176753/213789255.jpg/690x518/p_1, https://d.inmofactory.com/1/110026/16176753/213789258.jpg/690x518/p_1, https://d.inmofactory.com/1/110026/16176753/213789263.jpg/690x518/p_1, https://d.inmofactory.com/1/110026/16176753/213789266.jpg/690x518/p_1, https://d.inmofactory.com/1/110026/16176753/213789270.jpg/690x518/p_1, https://d.inmofactory.com/1/110026/16176753/213789273.jpg/690x518/p_1, https://d.inmofactory.com/1/110026/16176753/213789279.jpg/690x518/p_1, https://d.inmofactory.com/1/110026/16176753/213789283.jpg/690x518/p_1, https://d.inmofactory.com/1/110026/16176753/213789287.jpg/690x518/p_1","149536824","https://www.fotocasa.es/vivienda/martorell/calefaccion-calle-pep-ventura-149536824?RowGrid=19&tti=3&opi=300"
"Esparreguera","900","3","1","176","","Chalet en  Carrer Doctor Robert / Esparreguera","Tipo de inmueble : Chalet, Antigüedad : De 30 a 50 años, Orientación : Orientación Norte","Amueblado, Calefacción, Garaje Privado, Terraza","Global Serveis Fincas.Com","932754936","Referencia : 20181131 Contacto: Gemma Segura Gimenez","Este casa  chalet se encuentra en CAN RIAL, 08292, Esparreguera, Barcelona, situado en el distrito de CAN RIAL. Es un casa  chalet amueblado, construido en el año 1978, que tiene 176 m2 de los cuales 149 m2 son útiles y dispone de 3 habitaciones y 1 baños. Se trata de un inmueble independiente con orientación norte, barbacoa, parking y porche, pendiente de pintar interior  y exteriormente a cargo del propietario.    En Abrera: CManresa 9-15 bajos, En Martorell: CCervello 10 bajos, Delegado en Castelldefells y Bcn:  Isabel Walter. Si lo necesita, nosotros lo tenemos, o lo buscamos para Usted. Encuentra más en http globalserveisfincas","https://d.inmofactory.com/1/87718/16014272/210554580.jpg/690x518/p_1, https://d.inmofactory.com/1/87718/16014272/209635392.jpg/690x518/p_1, https://d.inmofactory.com/1/87718/16014272/210554581.jpg/690x518/p_1, https://d.inmofactory.com/1/87718/16014272/210554582.jpg/690x518/p_1, https://d.inmofactory.com/1/87718/16014272/209635398.jpg/690x518/p_1, https://d.inmofactory.com/1/87718/16014272/210554583.jpg/690x518/p_1, https://d.inmofactory.com/1/87718/16014272/210554584.jpg/690x518/p_1, https://d.inmofactory.com/1/87718/16014272/210554585.jpg/690x518/p_1, https://d.inmofactory.com/1/87718/16014272/210554586.jpg/690x518/p_1, https://d.inmofactory.com/1/87718/16014272/210554587.jpg/690x518/p_1, https://d.inmofactory.com/1/87718/16014272/210554588.jpg/690x518/p_1, https://d.inmofactory.com/1/87718/16014272/209635399.jpg/690x518/p_1, https://d.inmofactory.com/1/87718/16014272/210554589.jpg/690x518/p_1, https://d.inmofactory.com/1/87718/16014272/210554591.jpg/690x518/p_1, https://d.inmofactory.com/1/87718/16014272/210554592.jpg/690x518/p_1, https://d.inmofactory.com/1/87718/16014272/209635403.jpg/690x518/p_1, https://d.inmofactory.com/1/87718/16014272/209635404.jpg/690x518/p_1","149260499","https://www.fotocasa.es/vivienda/esparreguera/calefaccion-parking-terraza-amueblado-esparreguera-149260499?RowGrid=20&tti=3&opi=300"
"Martorell","750","3","2","110","","Piso en Martorell, Zona De - Martorell / Martorell","Tipo de inmueble : Piso, Estado : Muy buen estado, Antigüedad : De 5 a 10 años","Calefacción, Horno, Lavadero, No amueblado, Parquet, Suite - con baño, Terraza, Videoportero","Susana Ortiz Serveis Immobiliaris","931343743","Referencia : A122 Contacto: Susana Ortiz Serveis I...","Acogedor piso reformado, situado en Martorell, en zona muy tranquila, y a la vez cerca de todos los servicios. La vivienda se compone de amplio salón con acceso a una agradable terraza, cocina americana, 3 habitaciones, 2 baños, lavadero. No dispone de mobiliario ni electrodomésticos.","https://d.inmofactory.com/1/114224/15752062/204827573.jpg/690x518/p_1, https://d.inmofactory.com/1/114224/15752062/204827565.jpg/690x518/p_1, https://d.inmofactory.com/1/114224/15752062/204827555.jpg/690x518/p_1, https://d.inmofactory.com/1/114224/15752062/204827950.jpg/690x518/p_1, https://d.inmofactory.com/1/114224/15752062/204827608.jpg/690x518/p_1, https://d.inmofactory.com/1/114224/15752062/204827615.jpg/690x518/p_1, https://d.inmofactory.com/1/114224/15752062/204827810.jpg/690x518/p_1, https://d.inmofactory.com/1/114224/15752062/204827627.jpg/690x518/p_1","148918601","https://www.fotocasa.es/vivienda/martorell/calefaccion-terraza-no-amueblado-martorell-148918601?RowGrid=21&tti=3&opi=300"
"Collbató","1500","4","3","237","","Chalet en Collbató / Collbató","Tipo de inmueble : Chalet","Calefacción, Cocina Office, Garaje Privado, Lavadero, Trastero","Finques Isavi","932753128","Referencia : 4343 Contacto: Finques Isavi","Se alquila magnifica y espectacular casa a 4 vientos en zona inmejorable de Collbato ( CAN DALMASES) de superficie 237 m2, 4 habitaciones ( 2 suite + baño completo con plato de ducha), 3 baños completos y 1 aseo( 2 con plato de ducha y 1 con bañera), salon comedor amplio y luminoso con chimenea, cocina independiente equipada office, parcela de 400 m2, lavadero, suelo de gres, carp. exterior de aluminio climalit, calefaccion de gas natural, garaje de 100 m2, trastero, piscina con depuradora, estudio, porche, terraza, vistas a Montserrat, despensa. Se requiere 3 mesos de fianza. Toda exterior y muy luminosa. Lista para entrar a vivir. Gran oportunidad. POSIBILIDAD DE ALQUILER CON OPCION A COMPRA DANDO UNA ENTRADA: 50.000 € DE ENTRADA  PRECIO MENSUAL DE ALQUILER 1500 €.","https://d.inmofactory.com/1/92826/16037513/210236587.jpg/690x518/p_1, https://d.inmofactory.com/1/92826/16037513/210236588.jpg/690x518/p_1, https://d.inmofactory.com/1/92826/16037513/210236589.jpg/690x518/p_1, https://d.inmofactory.com/1/92826/16037513/210236590.jpg/690x518/p_1, https://d.inmofactory.com/1/92826/16037513/210236591.jpg/690x518/p_1, https://d.inmofactory.com/1/92826/16037513/210236592.jpg/690x518/p_1, https://d.inmofactory.com/1/92826/16037513/210236593.jpg/690x518/p_1, https://d.inmofactory.com/1/92826/16037513/210236594.jpg/690x518/p_1, https://d.inmofactory.com/1/92826/16037513/210236595.jpg/690x518/p_1, https://d.inmofactory.com/1/92826/16037513/210236596.jpg/690x518/p_1, https://d.inmofactory.com/1/92826/16037513/210236597.jpg/690x518/p_1, https://d.inmofactory.com/1/92826/16037513/210236598.jpg/690x518/p_1, https://d.inmofactory.com/1/92826/16037513/210236599.jpg/690x518/p_1, https://d.inmofactory.com/1/92826/16037513/210236600.jpg/690x518/p_1, https://d.inmofactory.com/1/92826/16037513/210236601.jpg/690x518/p_1, https://d.inmofactory.com/1/92826/16037513/210236602.jpg/690x518/p_1, https://d.inmofactory.com/1/92826/16037513/210236603.jpg/690x518/p_1, https://d.inmofactory.com/1/92826/16037513/210236604.jpg/690x518/p_1, https://d.inmofactory.com/1/92826/16037513/210236605.jpg/690x518/p_1, https://d.inmofactory.com/1/92826/16037513/210236606.jpg/690x518/p_1, https://d.inmofactory.com/1/92826/16037513/210236607.jpg/690x518/p_1, https://d.inmofactory.com/1/92826/16037513/210236608.jpg/690x518/p_1","149302035","https://www.fotocasa.es/vivienda/collbato/calefaccion-parking-trastero-collbato-149302035?RowGrid=22&tti=3&opi=300"
"Sant Esteve Sesrovires","1900","4","4","305","","Chalet en Sant Esteve Sesrovires / Sant Esteve Sesrovires","Tipo de inmueble : Chalet","Cocina Office, Garaje Privado, Piscina, Trastero","Finques Isavi","932753128","Referencia : 5773 Contacto: Finques Isavi","Se vende o se alquila con opcion a compra dando entrada espectacular y magnifica casa en zona inmejorable de Sant Esteve Sesrovires ( CAN AMAT) en la mejor calle, el año de construccion es del 2004, consta de 305m2, 4 habitaciones( 4 dobles ( 1 de ellas suite con baño completo con plato de ducha y bañera + vestidor), 4 baños completos ( 2 platos de ducha y 2 con bañera), salon comedor amplio y luminoso con chimenea, cocina independiente completa con electrodomesticos, parcela de 550m2, suelo de gress ceramica, ventanas de aluminio climalit + mosquitera, puertas interiores de madera, totalmente amueblado, jardin privado, piscina salina con depuradora y tambien consta de 1 cocina con barbacoa america, techo de la casa de madera muy bonito, golfas de parquet, zona tipo chill out en terraza alado de piscina, lavadero con despensadora, descalsificador general y osmosis, alarma, fibra optica, persianas automaticas y puerta de garage automatica, garage para 2 coches, trastero, calefaccion de gas natural. Cerca de parada de bus. Vistas excelente con vistas a montaña sin poder edificar. Toda exterior y muy luminosa. Lista para entrar a vivir. Gran oportunidad. CONDICIONES ALQUILER OPCION A COMPRA: Entrada de 40.000 €, Alquiler mensual de 1900€ a escriturar en 3 años ( 1 año a descontar el 100% del alquiler, 2º año el 75% del alquiler y el 3er año el 50% del alquiler)","https://d.inmofactory.com/1/92826/14663134/179792109.jpg/690x518/p_1, https://d.inmofactory.com/1/92826/14663134/179792108.jpg/690x518/p_1, https://d.inmofactory.com/1/92826/14663134/179792110.jpg/690x518/p_1, https://d.inmofactory.com/1/92826/14663134/179792111.jpg/690x518/p_1, https://d.inmofactory.com/1/92826/14663134/179792112.jpg/690x518/p_1, https://d.inmofactory.com/1/92826/14663134/179792114.jpg/690x518/p_1, https://d.inmofactory.com/1/92826/14663134/179792115.jpg/690x518/p_1, https://d.inmofactory.com/1/92826/14663134/179792116.jpg/690x518/p_1, https://d.inmofactory.com/1/92826/14663134/179792117.jpg/690x518/p_1, https://d.inmofactory.com/1/92826/14663134/179792118.jpg/690x518/p_1, https://d.inmofactory.com/1/92826/14663134/179792119.jpg/690x518/p_1, https://d.inmofactory.com/1/92826/14663134/179792120.jpg/690x518/p_1, https://d.inmofactory.com/1/92826/14663134/179792121.jpg/690x518/p_1, https://d.inmofactory.com/1/92826/14663134/179792122.jpg/690x518/p_1, https://d.inmofactory.com/1/92826/14663134/179792123.jpg/690x518/p_1, https://d.inmofactory.com/1/92826/14663134/179792124.jpg/690x518/p_1, https://d.inmofactory.com/1/92826/14663134/179792125.jpg/690x518/p_1, https://d.inmofactory.com/1/92826/14663134/179792126.jpg/690x518/p_1, https://d.inmofactory.com/1/92826/14663134/179792127.jpg/690x518/p_1, https://d.inmofactory.com/1/92826/14663134/179792128.jpg/690x518/p_1, https://d.inmofactory.com/1/92826/14663134/179792129.jpg/690x518/p_1, https://d.inmofactory.com/1/92826/14663134/179792130.jpg/690x518/p_1, https://d.inmofactory.com/1/92826/14663134/179792131.jpg/690x518/p_1, https://d.inmofactory.com/1/92826/14663134/179792132.jpg/690x518/p_1, https://d.inmofactory.com/1/92826/14663134/179792133.jpg/690x518/p_1, https://d.inmofactory.com/1/92826/14663134/179792134.jpg/690x518/p_1, https://d.inmofactory.com/1/92826/14663134/179792135.jpg/690x518/p_1","149334624","https://www.fotocasa.es/vivienda/sant-esteve-sesrovires/parking-trastero-piscina-sant-esteve-sesrovires-149334624?RowGrid=23&tti=3&opi=300"
