"Zona","Precio (€/mes)","Habitaciones","Baños","Metros cuadrados","Planta","Ubicación","Caracteristicas","Extras","Contacto","Telefono","Detalles contacto","Descripcion","Images","ref. Fotocasa","url"
"Sant Esteve Sesrovires","1100","4","1","181","","Casa adosada en Pasaje Estacion / Sant Esteve Sesrovires","Tipo de inmueble : Casa adosada, Estado : Buen estado, Antigüedad : De 30 a 50 años","Amueblado, Armarios, Calefacción, Cocina Equipada, Cocina Office, Electrodomésticos, Garaje Privado, Gres Cerámica, Horno, Internet, Jardín Privado, Lavadero, Lavadora, Microondas, Nevera, Puerta Blindada, Terraza, Trastero, TV, Vistas a la montaña, Z. Comunitaria, Zona Deportiva","Inmobiliaria La Gavina","935438591","Referencia : G102A Contacto: Gemma","Esta casa está situada a un minuto caminando de los ferrocarriles catalanes, a un paso del centro. Dispone de jardín privado, garaje, un gran y luminoso salón comedor , 4 habitaciones y una amplia cocina","https://d.inmofactory.com/1/105746/15723443/204162657.jpg/690x518/p_1, https://d.inmofactory.com/1/105746/15723443/204162093.jpg/690x518/p_1, https://d.inmofactory.com/1/105746/15723443/204162678.jpg/690x518/p_1, https://d.inmofactory.com/1/105746/15723443/204162373.jpg/690x518/p_1, https://d.inmofactory.com/1/105746/15723443/204162633.jpg/690x518/p_1, https://d.inmofactory.com/1/105746/15723443/204162008.jpg/690x518/p_1, https://d.inmofactory.com/1/105746/15723443/204162041.jpg/690x518/p_1, https://d.inmofactory.com/1/105746/15723443/204162054.jpg/690x518/p_1, https://d.inmofactory.com/1/105746/15723443/204162608.jpg/690x518/p_1, https://d.inmofactory.com/1/105746/15723443/204162079.jpg/690x518/p_1, https://d.inmofactory.com/1/105746/15723443/204162108.jpg/690x518/p_1, https://d.inmofactory.com/1/105746/15723443/204162133.jpg/690x518/p_1, https://d.inmofactory.com/1/105746/15723443/204162190.jpg/690x518/p_1, https://d.inmofactory.com/1/105746/15723443/204162209.jpg/690x518/p_1, https://d.inmofactory.com/1/105746/15723443/204162225.jpg/690x518/p_1, https://d.inmofactory.com/1/105746/15723443/204162341.jpg/690x518/p_1, https://d.inmofactory.com/1/105746/15723443/204162363.jpg/690x518/p_1, https://d.inmofactory.com/1/105746/15723443/204162576.jpg/690x518/p_1","148874359","https://www.fotocasa.es/vivienda/sant-esteve-sesrovires/calefaccion-parking-jardin-terraza-trastero-zona-comunitaria-amueblado-television-se-aceptan-mascotas-internet-pasaje-estacion-148874359?RowGrid=30&tti=3&opi=300"
"Sant Esteve Sesrovires","1900","5","4","376","","Chalet en Sant Esteve Sesrovires / Sant Esteve Sesrovires","Tipo de inmueble : Chalet, Estado : Casi nuevo, Orientación : Orientación Sur","Amueblado, Armarios, Balcón, Calefacción, Cocina Equipada, Cocina Office, Domótica, Electrodomésticos, Garaje Privado, Gres Cerámica, Jardín Privado, Parquet, Patio, Piscina, Suite - con baño, Terraza, Trastero, Vistas a la montaña","A&D Immobiliaria","935432875","Referencia : V-306 Contacto: Ad Immobiliaria","Fabuloso chalet de alto perfil, disponible también en ALQUILER CON OPCIÓN A COMPRA (entrada obligatoria de 40.000€) La vivienda independiente cuenta  con 376 m2 útiles, situada en Sant Esteve sesrovires, zona cotizada y tranquila, dispone de 5 habitaciones una de ellas estilo suite con baño privado y un amplio vestidor. La habitación de matrimonio comunica con una terraza con unas agradables vistas, la casa dispone de 3 plantas, en la 3 planta nos encontramos con una buhardilla habilitada para zona de descanso u oficina, la cocina totalmente reformada y amplia, el salón - comedor nos brinda un gran espacio y luminosidad, los suelos de parquet, calefacción gas ciudad, terraza de 100 m2 con vistas panorámicas, garaje para 3 coches con 110m2 útiles, cuenta además con una piscina grande en frente de la vivienda con zona chill-out en la terraza para disfrutar de total tranquilidad y relajación.  Llámanos para más información y pregunta por las condiciones","https://d.inmofactory.com/1/108745/16263946/215706629.jpg/690x518/p_1, https://d.inmofactory.com/1/108745/16263946/215706481.jpg/690x518/p_1, https://d.inmofactory.com/1/108745/16263946/215706483.jpg/690x518/p_1, https://d.inmofactory.com/1/108745/16263946/215706487.jpg/690x518/p_1, https://d.inmofactory.com/1/108745/16263946/215706494.jpg/690x518/p_1, https://d.inmofactory.com/1/108745/16263946/215706499.jpg/690x518/p_1, https://d.inmofactory.com/1/108745/16263946/215706505.jpg/690x518/p_1, https://d.inmofactory.com/1/108745/16263946/215706521.jpg/690x518/p_1, https://d.inmofactory.com/1/108745/16263946/215706530.jpg/690x518/p_1, https://d.inmofactory.com/1/108745/16263946/215706538.jpg/690x518/p_1, https://d.inmofactory.com/1/108745/16263946/215706548.jpg/690x518/p_1, https://d.inmofactory.com/1/108745/16263946/215706553.jpg/690x518/p_1, https://d.inmofactory.com/1/108745/16263946/215706561.jpg/690x518/p_1, https://d.inmofactory.com/1/108745/16263946/215706607.jpg/690x518/p_1, https://d.inmofactory.com/1/108745/16263946/215706615.jpg/690x518/p_1, https://d.inmofactory.com/1/108745/16263946/215706621.jpg/690x518/p_1, https://d.inmofactory.com/1/108745/16263946/215706626.jpg/690x518/p_1, https://d.inmofactory.com/1/108745/16263946/215706633.jpg/690x518/p_1, https://d.inmofactory.com/1/108745/16263946/215706642.jpg/690x518/p_1, https://d.inmofactory.com/1/108745/16263946/215706671.jpg/690x518/p_1, https://d.inmofactory.com/1/108745/16263946/215706674.jpg/690x518/p_1, https://d.inmofactory.com/1/108745/16263946/215706677.jpg/690x518/p_1, https://d.inmofactory.com/1/108745/16263946/215706679.jpg/690x518/p_1, https://d.inmofactory.com/1/108745/16263946/215706682.jpg/690x518/p_1, https://d.inmofactory.com/1/108745/16263946/215706683.jpg/690x518/p_1, https://d.inmofactory.com/1/108745/16263946/215706686.jpg/690x518/p_1, https://d.inmofactory.com/1/108745/16263946/215706688.jpg/690x518/p_1, https://d.inmofactory.com/1/108745/16263946/215706689.jpg/690x518/p_1, https://d.inmofactory.com/1/108745/16263946/215706692.jpg/690x518/p_1, https://d.inmofactory.com/1/108745/16263946/215706694.jpg/690x518/p_1, https://d.inmofactory.com/1/108745/16263946/215706696.jpg/690x518/p_1, https://d.inmofactory.com/1/108745/16263946/215706699.jpg/690x518/p_1, https://d.inmofactory.com/1/108745/16263946/215706701.jpg/690x518/p_1, https://d.inmofactory.com/1/108745/16263946/215706704.jpg/690x518/p_1, https://d.inmofactory.com/1/108745/16263946/215706708.jpg/690x518/p_1, https://d.inmofactory.com/1/108745/16263946/215706710.jpg/690x518/p_1, https://d.inmofactory.com/1/108745/16263946/215706725.jpg/690x518/p_1, https://d.inmofactory.com/1/108745/16263946/215706729.jpg/690x518/p_1","149657750","https://www.fotocasa.es/vivienda/sant-esteve-sesrovires/calefaccion-parking-jardin-terraza-trastero-patio-piscina-amueblado-se-aceptan-mascotas-sant-esteve-sesrovires-149657750?RowGrid=31&tti=3&opi=300"
"Abrera","1400","3","2","206","","Chalet en Abrera / Abrera","Tipo de inmueble : Chalet, Antigüedad : De 10 a 20 años","Calefacción, Cocina Office, Garaje Privado, Lavadero, Piscina, Terraza, Trastero, Vistas a la montaña","Finques Olesa","932752548","Referencia : 51043 Contacto: Finques Olesa","CASA EN PLENA NATURALEZA!!! VEN Y VERAS  LOS EXCELENTÍSIMOS ACABADOS!!!Casa en venta en Abrera-  206 m construidos - 190 m útil de vivienda en parcela de  2.025 m- salón comedor de 45 m con chimenea- cocina americana de diseño- lavadero- 3 habitaciones ( 2 dobles - 1 suitte )-estudio de 76 m-baño completo- aseo con plato de ducha - suelo de parket- carpintera exterior madera doble cristal- calefacción a gasoil- piscina con depuradora- trastero CASA EN PLENA NATURALEZA!!! VEN Y VERAS  LOS EXCELENTÍSIMOS ACABADOS!!! Superficie total 206 m², casa superficie solar 2025 m², superficie útil 190 m², habitaciones dobles: 3, hab. dobles son suites: 1, 2 baños, antigüedad entre 10 y 20 años, calefacción (gasoil), asfaltado, carpintería exterior (madera), carpintería interior (madera doble crista), chimenea, cocina (americana), comedor (45 m), estado conservación: buen estado, jardín (propio), lavadero (5 m), nº de planta: 1, piscina (propia), puerta blind., soleado, suelos: parquet, urbanizado, vidrios dobles, alumbrado.","https://d.inmofactory.com/1/93002/16263417/215694000.jpg/690x518/p_1, https://d.inmofactory.com/1/93002/16263417/215694001.jpg/690x518/p_1, https://d.inmofactory.com/1/93002/16263417/215694002.jpg/690x518/p_1, https://d.inmofactory.com/1/93002/16263417/215694003.jpg/690x518/p_1, https://d.inmofactory.com/1/93002/16263417/215694004.jpg/690x518/p_1, https://d.inmofactory.com/1/93002/16263417/215694005.jpg/690x518/p_1, https://d.inmofactory.com/1/93002/16263417/215694006.jpg/690x518/p_1, https://d.inmofactory.com/1/93002/16263417/215694007.jpg/690x518/p_1, https://d.inmofactory.com/1/93002/16263417/215694008.jpg/690x518/p_1, https://d.inmofactory.com/1/93002/16263417/215694009.jpg/690x518/p_1, https://d.inmofactory.com/1/93002/16263417/215694010.jpg/690x518/p_1, https://d.inmofactory.com/1/93002/16263417/215694011.jpg/690x518/p_1, https://d.inmofactory.com/1/93002/16263417/215694012.jpg/690x518/p_1, https://d.inmofactory.com/1/93002/16263417/215694013.jpg/690x518/p_1, https://d.inmofactory.com/1/93002/16263417/215694014.jpg/690x518/p_1, https://d.inmofactory.com/1/93002/16263417/215694015.jpg/690x518/p_1, https://d.inmofactory.com/1/93002/16263417/215694016.jpg/690x518/p_1, https://d.inmofactory.com/1/93002/16263417/215694017.jpg/690x518/p_1, https://d.inmofactory.com/1/93002/16263417/215694018.jpg/690x518/p_1, https://d.inmofactory.com/1/93002/16263417/215694019.jpg/690x518/p_1, https://d.inmofactory.com/1/93002/16263417/215694020.jpg/690x518/p_1, https://d.inmofactory.com/1/93002/16263417/215694022.jpg/690x518/p_1, https://d.inmofactory.com/1/93002/16263417/215694023.jpg/690x518/p_1, https://d.inmofactory.com/1/93002/16263417/215694024.jpg/690x518/p_1, https://d.inmofactory.com/1/93002/16263417/215694025.jpg/690x518/p_1, https://d.inmofactory.com/1/93002/16263417/215694026.jpg/690x518/p_1, https://d.inmofactory.com/1/93002/16263417/215694027.jpg/690x518/p_1, https://d.inmofactory.com/1/93002/16263417/215694028.jpg/690x518/p_1, https://d.inmofactory.com/1/93002/16263417/215694029.jpg/690x518/p_1, https://d.inmofactory.com/1/93002/16263417/215694030.jpg/690x518/p_1, https://d.inmofactory.com/1/93002/16263417/215694031.jpg/690x518/p_1","149657097","https://www.fotocasa.es/vivienda/abrera/calefaccion-parking-terraza-trastero-piscina-abrera-149657097?RowGrid=32&tti=3&opi=300"
"Collbató","850","4","2","160","","Casa adosada en Les Illes - Collbató / Collbató","Tipo de inmueble : Casa adosada, Estado : Muy buen estado, Antigüedad : De 10 a 20 años","Aire acondicionado, Amueblado, Armarios, Balcón, Calefacción, Cocina Office, Electrodomésticos, Garaje Privado, Gres Cerámica, Horno, Jardín Privado, Lavadero, Lavadora, Nevera, Puerta Blindada, Terraza, Vistas a la montaña","Fininform","932939346","Referencia : 002078 Contacto: Fininform","CASA ADOASADA DE 160 M2 DE 2 PLANTAS. TOTALMENTE REFORMADA. TERRAZA. PATIO DE 15 M2 DELANTE Y PATIO DE 25 M2 DETRAS. PLANTA PRIMERA : COMEDOR-SALÓN CON SALIDA TERRAZA + COCINA OFFICE  + 1 BAÑO. PLANTA PRIMERA :  4 HABITACIONES  + 1 BAÑO COMPLETO. PLANTA SÓTANOS : GARAGE CON SALIDA PATIO. CASA IMPECABLES. BOMBA DE CALOR. AIRE ACONDICONADO. TODA AMUEBLADA Y CON ELECTRODOMESTICOS. SUELO DE GRES. VENTANAS DE ALUMINIO.  PRECIO  850 EUROS - INCLUIDA CONTRIBUCIÓN-COMUNIDAD Y TASA DE BASURAS. DISPONIBILIDAD FINALES ENERO 2019.","https://d.inmofactory.com/1/85594/4812453/13989224.jpg/690x518/p_1, https://d.inmofactory.com/1/85594/4812453/208923301.jpg/690x518/p_1, https://d.inmofactory.com/1/85594/4812453/208922940.jpg/690x518/p_1, https://d.inmofactory.com/1/85594/4812453/208922947.jpg/690x518/p_1, https://d.inmofactory.com/1/85594/4812453/208923325.jpg/690x518/p_1, https://d.inmofactory.com/1/85594/4812453/13989219.jpg/690x518/p_1, https://d.inmofactory.com/1/85594/4812453/208923328.jpg/690x518/p_1, https://d.inmofactory.com/1/85594/4812453/208923335.jpg/690x518/p_1, https://d.inmofactory.com/1/85594/4812453/208923343.jpg/690x518/p_1, https://d.inmofactory.com/1/85594/4812453/13989221.jpg/690x518/p_1, https://d.inmofactory.com/1/85594/4812453/13989210.jpg/690x518/p_1","149299489","https://www.fotocasa.es/vivienda/collbato/aire-acondicionado-calefaccion-parking-jardin-terraza-amueblado-collbato-149299489?RowGrid=33&tti=3&opi=300"
"Castellví de Rosanes","900","3","2","140","","Chalet en El Taio / Castellví de Rosanes","Tipo de inmueble : Chalet, Estado : Casi nuevo, Antigüedad : De 5 a 10 años","Balcón, Jardín Privado, Terraza","Mareus Sl","932938732","Referencia : 768 Contacto: Diaz, Yurena","Preciosa casa de madera, cómodamente distribuida, con terreno, zona para hacer barbacoas y una vistas fabulosas. La casa es muy acogedora y se distribuye en 3 hab completas y 2 baños, cocina semi abierta al comedor y salida directa al jardín.","https://d.inmofactory.com/1/86905/13550579/157923792.jpg/690x518/p_1, https://d.inmofactory.com/1/86905/13550579/157923802.jpg/690x518/p_1, https://d.inmofactory.com/1/86905/13550579/157923816.jpg/690x518/p_1, https://d.inmofactory.com/1/86905/13550579/157923909.jpg/690x518/p_1, https://d.inmofactory.com/1/86905/13550579/157923854.jpg/690x518/p_1, https://d.inmofactory.com/1/86905/13550579/157923873.jpg/690x518/p_1","149651195","https://www.fotocasa.es/vivienda/castellvi-de-rosanes/jardin-terraza-castellvi-de-rosanes-149651195?RowGrid=34&tti=3&opi=300"
"Olesa de Montserrat","1200","5","2","150","","Chalet en Olesa De Montserrat, Zona De Les Planes / Olesa de Montserrat","Tipo de inmueble : Chalet, Estado : Casi nuevo, Antigüedad : De 20 a 30 años","Aire acondicionado, Armarios, Balcón, Calefacción, Cocina Equipada, Cocina Office, Gres Cerámica, Horno, Jardín Privado, Lavadero, Patio, Terraza, Vistas a la montaña","Finques Bià","932756715","Referencia : 13-39 Contacto: Finques Bià","Casa en Olesa de Montserrat zona Les planes, 150 m. de superficie, 210 m. superficie parcela, 12 m2 de cocina, 20 m2 de comedor, 9 m2 de terraza, 4 habitaciones dobles y  una habitación sencilla, 2 baños, propiedad seminueva, cocina equipada, orientación este, suelo de gres, carpintería exterior de aluminio. Extras: agua, aire acondicionado , arma. empotrados, balcón , barbacoa, buhardilla , calefacción, chimenea, despensa, gas ciudad , jardín , luminoso, luz, patio, pérgola, terraza, todo exterior, colegios, urbanización, vistas despejadas","https://d.inmofactory.com/1/95491/8313069/63160061.jpg/690x518/p_1, https://d.inmofactory.com/1/95491/8313069/63159448.jpg/690x518/p_1, https://d.inmofactory.com/1/95491/8313069/63159461.jpg/690x518/p_1, https://d.inmofactory.com/1/95491/8313069/63159514.jpg/690x518/p_1, https://d.inmofactory.com/1/95491/8313069/63159532.jpg/690x518/p_1, https://d.inmofactory.com/1/95491/8313069/63159547.jpg/690x518/p_1, https://d.inmofactory.com/1/95491/8313069/63159922.jpg/690x518/p_1, https://d.inmofactory.com/1/95491/8313069/63159977.jpg/690x518/p_1, https://d.inmofactory.com/1/95491/8313069/63159990.jpg/690x518/p_1, https://d.inmofactory.com/1/95491/8313069/63159965.jpg/690x518/p_1, https://d.inmofactory.com/1/95491/8313069/63160036.jpg/690x518/p_1, https://d.inmofactory.com/1/95491/8313069/63160002.jpg/690x518/p_1, https://d.inmofactory.com/1/95491/8313069/63159485.jpg/690x518/p_1, https://d.inmofactory.com/1/95491/8313069/63159492.jpg/690x518/p_1, https://d.inmofactory.com/1/95491/8313069/63159911.jpg/690x518/p_1, https://d.inmofactory.com/1/95491/8313069/63159477.jpg/690x518/p_1, https://d.inmofactory.com/1/95491/8313069/63159931.jpg/690x518/p_1, https://d.inmofactory.com/1/95491/8313069/63159950.jpg/690x518/p_1, https://d.inmofactory.com/1/95491/8313069/63160082.jpg/690x518/p_1, https://d.inmofactory.com/1/95491/8313069/63160105.jpg/690x518/p_1","149173168","https://www.fotocasa.es/vivienda/olesa-de-montserrat/aire-acondicionado-calefaccion-jardin-terraza-patio-olesa-de-montserrat-149173168?RowGrid=35&tti=3&opi=300"
"Martorell","810","3","1","102","","Piso en  Montserrat / Martorell","Tipo de inmueble : Piso, Estado : Casi nuevo, Antigüedad : De 30 a 50 años","Ascensor, Calefacción, Cocina Equipada, Lavadero, No amueblado, Puerta Blindada, Terraza, Trastero, Z. Comunitaria","Inveriba","932934650","Referencia : 1357 Contacto: Inveriba","Piso en alquiler en Martorell, Barcelona. Dispone de una superficie de 102 m² distribuidos en amplio salón-comedor, 3 habitaciones, cocina con lavadero, 1 baño y el balcón. Finca con ascensor.Dispone de trastero.Piso situado alrededor de servicios, comercios, una escuela y paradas de autobús. Con fácil acceso en ferrocarril a la estación Martorell Central . Se alquila sin amueblar. Para concertar una visita deja tus datos en esta web y el comercial de la zona contactará tan pronto como sea posible.REQUISITOS PARA PODER REALIZAR UNA VISITA- Al menos uno de los inquilinos debe tener contrato indefinido.- La suma de los ingresos de los inquilinos debe ser al menos de 2.450€ para este inmueble en concreto.","https://d.inmofactory.com/1/93528/16240755/215314225.jpg/690x518/p_1, https://d.inmofactory.com/1/93528/16240755/215314226.jpg/690x518/p_1, https://d.inmofactory.com/1/93528/16240755/215314227.jpg/690x518/p_1, https://d.inmofactory.com/1/93528/16240755/215314228.jpg/690x518/p_1, https://d.inmofactory.com/1/93528/16240755/215314229.jpg/690x518/p_1, https://d.inmofactory.com/1/93528/16240755/215314230.jpg/690x518/p_1, https://d.inmofactory.com/1/93528/16240755/215314231.jpg/690x518/p_1, https://d.inmofactory.com/1/93528/16240755/215314232.jpg/690x518/p_1, https://d.inmofactory.com/1/93528/16240755/215314233.jpg/690x518/p_1, https://d.inmofactory.com/1/93528/16240755/215314234.jpg/690x518/p_1, https://d.inmofactory.com/1/93528/16240755/215314235.jpg/690x518/p_1, https://d.inmofactory.com/1/93528/16240755/215314236.jpg/690x518/p_1, https://d.inmofactory.com/1/93528/16240755/215314237.jpg/690x518/p_1","149640091","https://www.fotocasa.es/vivienda/martorell/calefaccion-terraza-trastero-zona-comunitaria-ascensor-se-aceptan-mascotas-no-amueblado-martorell-149640091?RowGrid=1&tti=3&opi=300"
"Castellví de Rosanes","3900","6","3","350","","Chalet en Calle Serral / Castellví de Rosanes","Tipo de inmueble : Chalet, Estado : Casi nuevo, Antigüedad : De 10 a 20 años","Aire acondicionado, Amueblado, Armarios, Balcón, Calefacción, Cocina Equipada, Cocina Office, Electrodomésticos, Garaje Privado, Gres Cerámica, Horno, Internet, Jardín Privado, Lavadero, Lavadora, Microondas, Nevera, No amueblado, Parquet, Patio, Piscina, Puerta Blindada, Suite - con baño, Terraza, Trastero, TV, Vistas a la montaña, Zona Deportiva, Zona Infantil","1001 Pisos","932752131","Referencia : 2018 Contacto: Dpto. comercial","Casa unifamiliar independiente, en parcela de 7.099 m², estratégicamente ubicada en el centro de la localidad de Castellví de Rosanes. A 20 minutos de Barcelona, disfrutarás de la visita a la región del vino y del cava (el champagne español) así como podrás disfrutar realizar rutas en bicicleta, ir a jugar al golf, disfrutar de la impresionante gastronomía y restaurantes o vivir junto a la comarca más tranquila del área metropolitana de Barcelona. Con todas las comodidades en el entorno (comercios, servicios, transporte público, colegios, ayuntamiento). Encontrarás supermercado, farmacia, bar, restaurante a menos de 1 minuto andando, por lo que no será necesario el uso de vehículo privado en el día a día para satisfacer las necesidades más cotidianas. La casa está emplazada en lo alto de la cima del pueblo, con las casas de los vecinos de la villa en las faldas del Turó.  Villa totalmente privada de indiscreciones, soleada todo el día y con vistas 360º privilegiadas del entorno de 2 comarcas, vistas sobre la enigmática montaña de Montserrat. La casa dispone 414 m² construidos, repartidos en varias dependencias. Cuenta con 6 dormitorios y 3 baños + 1 aseo, distribuidas en 3 plantas. En la planta baja, dispondremos del acceso principal y secundarios. Gran hall de magnífica entrada de carruajes a la zona principal del inmueble. Muy amplia cocina independiente, cocina a gas, horno, campana extractora, con zona de comedor tipo office dentro de la misma cocina. Armarios amplios, altos y bajos. Pica de 2 senos. Aseo independiente y sala polivalente y dos dormitorios. Gran zona de salón comedor living, con majestuosa chimenea. Comedor de verano de pórticos romanos, con acceso desde la planta. Planta segunda con 4 dormitorios (3 dobles + 1 individual) + 2 baños (1 de ellos integrado en la suite principal de matrimonio) Planta tercera con 2 dormitorios (1 doble + 1 individual) + 1 baño completo. Amplio garaje de 94 m² construidos que permiten el aparcamiento de","https://d.inmofactory.com/1/93911/15538146/199933532.jpg/690x518/p_1, https://d.inmofactory.com/1/93911/15538146/199933541.jpg/690x518/p_1, https://d.inmofactory.com/1/93911/15538146/199933562.jpg/690x518/p_1, https://d.inmofactory.com/1/93911/15538146/199933582.jpg/690x518/p_1, https://d.inmofactory.com/1/93911/15538146/199933589.jpg/690x518/p_1, https://d.inmofactory.com/1/93911/15538146/199933604.jpg/690x518/p_1, https://d.inmofactory.com/1/93911/15538146/199933620.jpg/690x518/p_1, https://d.inmofactory.com/1/93911/15538146/199933624.jpg/690x518/p_1, https://d.inmofactory.com/1/93911/15538146/199933629.jpg/690x518/p_1, https://d.inmofactory.com/1/93911/15538146/199933636.jpg/690x518/p_1, https://d.inmofactory.com/1/93911/15538146/199933663.jpg/690x518/p_1, https://d.inmofactory.com/1/93911/15538146/199933667.jpg/690x518/p_1, https://d.inmofactory.com/1/93911/15538146/199933677.jpg/690x518/p_1, https://d.inmofactory.com/1/93911/15538146/199933699.jpg/690x518/p_1, https://d.inmofactory.com/1/93911/15538146/199933706.jpg/690x518/p_1, https://d.inmofactory.com/1/93911/15538146/199933709.jpg/690x518/p_1, https://d.inmofactory.com/1/93911/15538146/199933718.jpg/690x518/p_1, https://d.inmofactory.com/1/93911/15538146/199933720.jpg/690x518/p_1, https://d.inmofactory.com/1/93911/15538146/199933805.jpg/690x518/p_1, https://d.inmofactory.com/1/93911/15538146/199933821.jpg/690x518/p_1, https://d.inmofactory.com/1/93911/15538146/199933827.jpg/690x518/p_1, https://d.inmofactory.com/1/93911/15538146/199933887.jpg/690x518/p_1, https://d.inmofactory.com/1/93911/15538146/199933895.jpg/690x518/p_1, https://d.inmofactory.com/1/93911/15538146/199933901.jpg/690x518/p_1, https://d.inmofactory.com/1/93911/15538146/199933905.jpg/690x518/p_1, https://d.inmofactory.com/1/93911/15538146/199933932.jpg/690x518/p_1, https://d.inmofactory.com/1/93911/15538146/199933964.jpg/690x518/p_1, https://d.inmofactory.com/1/93911/15538146/199933970.jpg/690x518/p_1, https://d.inmofactory.com/1/93911/15538146/199933983.jpg/690x518/p_1, https://d.inmofactory.com/1/93911/15538146/199933991.jpg/690x518/p_1, https://d.inmofactory.com/1/93911/15538146/199934030.jpg/690x518/p_1, https://d.inmofactory.com/1/93911/15538146/199934045.jpg/690x518/p_1, https://d.inmofactory.com/1/93911/15538146/199934071.jpg/690x518/p_1, https://d.inmofactory.com/1/93911/15538146/199934091.jpg/690x518/p_1, https://d.inmofactory.com/1/93911/15538146/199934175.jpg/690x518/p_1, https://d.inmofactory.com/1/93911/15538146/199934182.jpg/690x518/p_1, https://d.inmofactory.com/1/93911/15538146/199934198.jpg/690x518/p_1","148563978","https://www.fotocasa.es/vivienda/castellvi-de-rosanes/aire-acondicionado-calefaccion-parking-jardin-terraza-trastero-patio-piscina-amueblado-television-se-aceptan-mascotas-internet-no-amueblado-calle-serral-148563978?RowGrid=2&tti=3&opi=300"
